{
  "$id": "./data/drugs.json",
  "title": "Drugs Dataset",
  "description": "Offgrid drugs feed with street stock formulas and procedural generation options.",
  "type": "drugs",
  "version": "1.10",
  "author": "Hendo",
  "date": "2026-03-25",
  "data": {
    "street_stock": {
      "Description": "Common street drugs from the Cyberpunk 2020 Corebook.",
      "items": {
        "synthcoke": {
          "name": "SynthCoke",
          "type": "stimulant",
          "strength": "+1",
          "difficulty": 20,
          "price": "1000",
          "duration": "1D6+1 minutes",
          "effects": "Stimulant high; paranoia and psychological addiction",
          "description": "The second-generation synthetic replacement for cocaine. Like the original, its side effects are nasty: paranoia and psychological addiction."
        },
        "stim": {
          "name": "Stim",
          "type": "stimulant",
          "strength": "+3",
          "difficulty": 10,
          "price": "500",
          "duration": "1D6+1 minutes",
          "effects": "Increases endurance and alertness",
          "description": "Stim increases endurance, allowing the user to stay alert for longer periods. Side effects include mental delusions."
        },
        "syncomp_15": {
          "name": "Syncomp 15",
          "type": "antidote",
          "strength": "+3",
          "difficulty": 13,
          "price": "650",
          "duration": "1D6+1 turns",
          "effects": "Broad-spectrum antidote",
          "description": "Syncomp is a broad-spectrum poison antidote used to treat nerve and biotoxins. REF is reduced at the rate of 1 point per dose."
        },
        "speedheal": {
          "name": "Speedheal",
          "type": "healing-drug",
          "strength": "+2",
          "difficulty": 33,
          "price": "1650",
          "duration": "1D6+1 hours",
          "effects": "Enhances natural healing",
          "description": "Speedheal is designed to enhance the natural healing processes. Side effects reduce REF by 1D6/3 for one week after use."
        },
        "boost": {
          "name": "Boost",
          "type": "int-booster",
          "strength": "+4",
          "difficulty": 12,
          "price": "600",
          "duration": "1D6+1 hours",
          "effects": "Raises INT by +1 temporarily",
          "description": "Boost increases INT by +1 for a 2-7 hour period. A Boost addict who has gained full tolerance can no longer increase INT and must have more Boost within twelve hours or suffer screaming fits and hallucinations."
        },
        "blue_glass": {
          "name": "Blue Glass",
          "type": "hallucinogenic",
          "strength": "+1",
          "difficulty": 18,
          "price": "900",
          "duration": "1D6+1 minutes",
          "effects": "Hallucinogenic flashout risk",
          "description": "Blue Glass was originally developed as a biological weapon. Under stress, there is a 3 in 10 chance of flashing out and staring blankly at the pretty colors in your mind. Reduce INT by 1 per dose."
        },
        "smash": {
          "name": "Smash",
          "type": "euphoric",
          "strength": "+1",
          "difficulty": 2,
          "price": "100",
          "duration": "1D6+1 minutes",
          "effects": "Euphoria and party state",
          "description": "Smash is 2020's answer to alcohol. It is yellow, foamy, comes in cans, and makes you loose, happy and ready to party. Withdrawal can trigger suicidal episodes and total catatonia.",
          "pack": "6 pk"
        },
        "dorph": {
          "name": "'Dorph",
          "type": "pain-negation",
          "strength": "+2",
          "difficulty": 5,
          "price": "250",
          "duration": "1D6+1 turns",
          "effects": "Reduces pain, stun and shock",
          "description": "Designed as a combat drug and painkiller, endorphins reduce pain and stress. 'Dorph lets you reduce the effects of stun or shock, but it damages the nervous system: each use adds one extra 1D10 roll; on a 1, the user permanently loses 1 REF."
        },
        "black_lace": {
          "name": "Black Lace",
          "type": "pain-negation",
          "strength": "+3",
          "difficulty": 13,
          "price": "650",
          "duration": "1D6+1 hours",
          "effects": "Euphoria, adrenal rush and pain invulnerability",
          "description": "A high-powered version of 'Dorph that imparts euphoria, an adrenal rush and invulnerability to pain. CL rises by 2 and the user resists stun or shock. Failed addiction can cause EMP loss and cyberpsychosis."
        }
      }
    },
    "generatorOptions": {
      "Description": "Official drug creation tables transcribed from the Cyberpunk 2020 Corebook.",
      "types": {
        "stimulant": {
          "label": "Stimulant",
          "baseDifficulty": 0,
          "basePrice": "500"
        },
        "euphoric": {
          "label": "Euphoric",
          "baseDifficulty": 0,
          "basePrice": "250"
        },
        "hallucinogenic": {
          "label": "Hallucinogenic",
          "baseDifficulty": 0,
          "basePrice": "800"
        },
        "pain-negation": {
          "label": "Pain Negation",
          "baseDifficulty": 0,
          "basePrice": "400"
        },
        "healing-drug": {
          "label": "Healing Drug",
          "baseDifficulty": 0,
          "basePrice": "1200"
        },
        "antidote": {
          "label": "Antidote",
          "baseDifficulty": 0,
          "basePrice": "600"
        },
        "int-booster": {
          "label": "INT Booster",
          "baseDifficulty": 0,
          "basePrice": "600"
        }
      },
      "strengthOptions": [
        {
          "value": "1",
          "difficultyMod": 1,
          "priceMod": "0",
          "rule": "Add drug Strength to the body and to base formula."
        },
        {
          "value": "2",
          "difficultyMod": 2,
          "priceMod": "0",
          "rule": "Add drug Strength to the body and to base formula."
        },
        {
          "value": "3",
          "difficultyMod": 3,
          "priceMod": "0",
          "rule": "Add drug Strength to the body and to base formula."
        }
      ],
      "durationOptions": [
        {
          "value": "1D10+1 turns",
          "difficultyMod": 1,
          "priceMod": "0",
          "multiplier": 1
        },
        {
          "value": "1D10+1 minutes",
          "difficultyMod": 2,
          "priceMod": "0",
          "multiplier": 2
        },
        {
          "value": "1D10+1 hours",
          "difficultyMod": 3,
          "priceMod": "0",
          "multiplier": 3
        }
      ],
      "effectOptions": [
        {
          "id": "increase_ref",
          "label": "Increase REF by Strength of drug",
          "difficultyMod": 15,
          "priceMod": "0"
        },
        {
          "id": "increase_int",
          "label": "Increase INT by Strength of drug",
          "difficultyMod": 15,
          "priceMod": "0"
        },
        {
          "id": "increase_cl",
          "label": "Increase CL by Strength of drug",
          "difficultyMod": 15,
          "priceMod": "0"
        },
        {
          "id": "enhanced_perception",
          "label": "Enhanced Perception (+Strength to Awareness checks)",
          "difficultyMod": 15,
          "priceMod": "0"
        },
        {
          "id": "healing_rate",
          "label": "Increase healing rate 1 point per point of Strength",
          "difficultyMod": 15,
          "priceMod": "0"
        },
        {
          "id": "antidote",
          "label": "Antidote (+1 to Save per Strength)",
          "difficultyMod": 15,
          "priceMod": "0"
        },
        {
          "id": "increased_endurance",
          "label": "Increased Endurance (+Strength to Endurance checks)",
          "difficultyMod": 10,
          "priceMod": "0"
        },
        {
          "id": "negate_pain",
          "label": "Negate Pain effects (+Strength to Stun saves)",
          "difficultyMod": 10,
          "priceMod": "0"
        },
        {
          "id": "depressant",
          "label": "Depressant (-Strength to Awareness)",
          "difficultyMod": 5,
          "priceMod": "0"
        },
        {
          "id": "euphoric",
          "label": "Euphoric (makes you feel good)",
          "difficultyMod": 5,
          "priceMod": "0"
        },
        {
          "id": "hallucinogenic",
          "label": "Hallucinogenic (makes you see things)",
          "difficultyMod": 10,
          "priceMod": "0"
        },
        {
          "id": "reduce_stun",
          "label": "Reduce Stun (+Strength to Stun saves)",
          "difficultyMod": 10,
          "priceMod": "0"
        },
        {
          "id": "soporific",
          "label": "Soporific (-Strength to Save vs. Sleep)",
          "difficultyMod": 5,
          "priceMod": "0"
        },
        {
          "id": "aphrodesiac",
          "label": "Aphrodesiac (-Strength to resist Seduction checks)",
          "difficultyMod": 10,
          "priceMod": "0"
        },
        {
          "id": "contraceptive",
          "label": "Contraceptive (male or female)",
          "difficultyMod": 10,
          "priceMod": "0"
        },
        {
          "id": "antibiotic",
          "label": "Antibiotic (+Strength to Saves vs. disease)",
          "difficultyMod": 10,
          "priceMod": "0"
        }
      ],
      "riskOptions": [
        {
          "id": "psychological_addiction",
          "label": "Psychological Addiction",
          "severity": "high",
          "difficultyMod": -8,
          "priceMod": "0",
          "rule": "The character must roll under CL each hour after the last dose. Failure causes extreme anxiety, fear and depression and drives the character to seek more of the drug. Kicking the addiction requires a Very Difficult Endurance check and as much time as the Referee decides."